{
  "format": "mds.digest",
  "version": "1.0",
  "engine": "mysql",
  "server": "8.4.3",
  "database": "loja",
  "capturedAt": "2026-10-11T14:05:40Z",
  "hash": "sha256:9a8b7c6d5e4f30211234567890abcdef0fedcba0987654321a1b2c3d4e5f6a7b",
  "options": { "views": true, "routines": true, "triggers": true, "comments": false },
  "namespaces": [
    {
      "name": "loja",
      "x": { "defaultCharset": "utf8mb4", "defaultCollation": "utf8mb4_0900_ai_ci", "sqlMode": "ONLY_FULL_GROUP_BY,STRICT_TRANS_TABLES,NO_ZERO_IN_DATE,NO_ZERO_DATE,ERROR_FOR_DIVISION_BY_ZERO,NO_ENGINE_SUBSTITUTION" },
      "tables": [
        {
          "name": "categoria",
          "cols": [
            ["id", "int unsigned", "nn ai"],
            ["nome", "varchar(60)", "nn"],
            ["pai_id", "int unsigned"]
          ],
          "pk": ["id"],
          "fk": [ { "n": "fk_categoria_pai", "c": ["pai_id"], "r": "loja.categoria", "rc": ["id"], "od": "setnull" } ],
          "uq": [ { "n": "uq_categoria_nome", "c": ["nome"], "ix": true } ],
          "ix": [ { "n": "fk_categoria_pai", "c": ["pai_id"] } ],
          "x": { "engine": "InnoDB" }
        },
        {
          "name": "cliente",
          "cols": [
            ["id", "bigint unsigned", "nn ai"],
            ["nome", "varchar(120)", "nn"],
            ["cpf", "char(11)", "nn"],
            ["email", "varchar(200)"],
            ["zap", "varchar(20)"],
            ["nro_cep", "char(8)"],
            ["cidade", "varchar(80)"],
            ["uf", "char(2)"],
            ["nascimento", "date"],
            ["ativo", "tinyint(1)", "nn", { "def": "1" }],
            ["criado_em", "datetime", "nn", { "def": "CURRENT_TIMESTAMP" }]
          ],
          "pk": ["id"],
          "uq": [
            { "n": "uq_cliente_cpf", "c": ["cpf"], "ix": true },
            { "n": "ux_cliente_email", "c": ["email"], "ix": true }
          ],
          "ix": [ { "n": "ix_cliente_nome", "c": ["nome"] } ],
          "ck": [ { "n": "ck_cliente_uf", "e": "regexp_like(`uf`,_utf8mb4'^[A-Z]{2}$')" } ],
          "x": { "engine": "InnoDB" }
        },
        {
          "name": "produto",
          "cols": [
            ["id", "int unsigned", "nn ai"],
            ["sku", "varchar(20)", "nn"],
            ["descricao", "varchar(150)", "nn"],
            ["categoria_id", "int unsigned", "nn"],
            ["preco", "decimal(12,2)", "nn"],
            ["estoque", "int", "nn", { "def": "0" }],
            ["atributos", "json"]
          ],
          "pk": ["id"],
          "fk": [ { "n": "fk_produto_categoria", "c": ["categoria_id"], "r": "loja.categoria", "rc": ["id"] } ],
          "uq": [ { "n": "uq_produto_sku", "c": ["sku"], "ix": true } ],
          "ix": [ { "n": "fk_produto_categoria", "c": ["categoria_id"] } ],
          "ck": [ { "n": "ck_produto_preco", "e": "(`preco` >= 0)" } ],
          "x": { "engine": "InnoDB" }
        },
        {
          "name": "pedido",
          "cols": [
            ["id", "bigint unsigned", "nn ai"],
            ["cliente_id", "bigint unsigned", "nn"],
            ["data_pedido", "datetime", "nn"],
            ["status", "enum", "nn", { "def": "ABERTO", "enum": ["ABERTO", "PAGO", "ENVIADO", "CANCELADO"] }],
            ["total", "decimal(14,2)", "nn", { "def": "0.00" }],
            ["total_com_frete", "decimal(14,2)", "gs", { "gx": "(`total` + 15.00)" }]
          ],
          "pk": ["id"],
          "fk": [ { "n": "fk_pedido_cliente", "c": ["cliente_id"], "r": "loja.cliente", "rc": ["id"] } ],
          "ix": [ { "n": "fk_pedido_cliente", "c": ["cliente_id"] } ],
          "x": { "engine": "InnoDB" }
        },
        {
          "name": "item_pedido",
          "cols": [
            ["pedido_id", "bigint unsigned", "nn"],
            ["item_seq", "smallint unsigned", "nn"],
            ["produto_id", "int unsigned", "nn"],
            ["quantidade", "int", "nn"],
            ["preco_unit", "decimal(12,2)", "nn"]
          ],
          "pk": ["pedido_id", "item_seq"],
          "fk": [
            { "n": "fk_item_pedido", "c": ["pedido_id"], "r": "loja.pedido", "rc": ["id"], "od": "cascade" },
            { "n": "fk_item_produto", "c": ["produto_id"], "r": "loja.produto", "rc": ["id"] }
          ],
          "ix": [ { "n": "fk_item_produto", "c": ["produto_id"] } ],
          "ck": [ { "n": "ck_item_qtd", "e": "(`quantidade` > 0)" } ],
          "x": { "engine": "InnoDB" }
        },
        {
          "name": "entrega",
          "cols": [
            ["id", "char(36)", "nn", { "def": "(uuid())" }],
            ["pedido_id", "bigint unsigned", "nn"],
            ["item_seq", "smallint unsigned", "nn"],
            ["previsao", "date"],
            ["cep_entrega", "char(8)", "nn"]
          ],
          "pk": ["id"],
          "fk": [ { "n": "fk_entrega_item", "c": ["pedido_id", "item_seq"], "r": "loja.item_pedido", "rc": ["pedido_id", "item_seq"] } ],
          "uq": [ { "n": "uq_entrega_item", "c": ["pedido_id", "item_seq"], "ix": true } ],
          "x": { "engine": "InnoDB" }
        }
      ],
      "views": [
        { "name": "vw_pedidos_cliente", "cols": [["cliente_id", "bigint unsigned", "nn"], ["qtd_pedidos", "bigint", "nn"], ["valor_total", "decimal(36,2)"]], "upd": false }
      ],
      "routines": [
        { "n": "fn_total_pedido", "k": "f", "p": 1, "rt": "decimal(14,2)" },
        { "n": "sp_fechar_pedido", "k": "p", "p": 1 }
      ],
      "triggers": [
        { "n": "trg_item_ai", "t": "item_pedido", "tm": "a", "ev": "i" },
        { "n": "trg_item_au", "t": "item_pedido", "tm": "a", "ev": "u" },
        { "n": "trg_item_ad", "t": "item_pedido", "tm": "a", "ev": "d" }
      ]
    }
  ]
}
