{
  "format": "mds.digest",
  "version": "1.0",
  "engine": "sqlite",
  "server": "3.46.1",
  "database": "loja.db",
  "capturedAt": "2026-10-11T14:01:05Z",
  "hash": "sha256:0b1c2d3e4f5a69788796a5b4c3d2e1f00112233445566778899aabbccddeeff0",
  "options": { "views": true, "routines": false, "triggers": true, "comments": false },
  "namespaces": [
    {
      "name": "main",
      "tables": [
        {
          "name": "categoria",
          "cols": [
            ["id", "integer", "nn ai"],
            ["nome", "varchar(60)", "nn"],
            ["pai_id", "integer"]
          ],
          "pk": ["id"],
          "fk": [ { "n": "fk_categoria_0", "c": ["pai_id"], "r": "main.categoria", "rc": ["id"], "od": "setnull" } ],
          "uq": [ { "c": ["nome"] } ]
        },
        {
          "name": "cliente",
          "cols": [
            ["id", "integer", "nn ai"],
            ["nome", "varchar(120)", "nn"],
            ["cpf", "char(11)", "nn"],
            ["email", "varchar(200)"],
            ["zap", "varchar(20)"],
            ["nro_cep", "char(8)"],
            ["cidade", "varchar(80)"],
            ["uf", "char(2)"],
            ["nascimento", "date"],
            ["ativo", "boolean", "nn", { "def": "1" }],
            ["criado_em", "datetime", "nn", { "def": "CURRENT_TIMESTAMP" }]
          ],
          "pk": ["id"],
          "uq": [
            { "c": ["cpf"] },
            { "n": "ux_cliente_email", "c": ["email"], "ix": true }
          ],
          "ix": [ { "n": "ix_cliente_nome", "c": ["nome"] } ],
          "ck": [ { "e": "length(uf) = 2" } ]
        },
        {
          "name": "produto",
          "cols": [
            ["id", "integer", "nn ai"],
            ["sku", "text", "nn"],
            ["descricao", "text", "nn"],
            ["categoria_id", "integer", "nn"],
            ["preco", "numeric(12,2)", "nn"],
            ["estoque", "integer", "nn", { "def": "0" }],
            ["atributos", "json"]
          ],
          "pk": ["id"],
          "fk": [ { "n": "fk_produto_0", "c": ["categoria_id"], "r": "main.categoria", "rc": ["id"] } ],
          "uq": [ { "c": ["sku"] } ],
          "ck": [ { "e": "preco >= 0" } ],
          "x": { "strict": "0" }
        },
        {
          "name": "pedido",
          "cols": [
            ["id", "integer", "nn ai"],
            ["cliente_id", "integer", "nn"],
            ["data_pedido", "datetime", "nn"],
            ["status", "text", "nn", { "def": "'ABERTO'" }],
            ["total", "numeric(14,2)", "nn", { "def": "0" }],
            ["total_com_frete", "numeric(14,2)", "gv", { "gx": "total + 15.00" }]
          ],
          "pk": ["id"],
          "fk": [ { "n": "fk_pedido_0", "c": ["cliente_id"], "r": "main.cliente", "rc": ["id"] } ],
          "ck": [ { "e": "status IN ('ABERTO','PAGO','ENVIADO','CANCELADO')" } ]
        },
        {
          "name": "item_pedido",
          "cols": [
            ["pedido_id", "integer", "nn"],
            ["item_seq", "integer", "nn"],
            ["produto_id", "integer", "nn"],
            ["quantidade", "integer", "nn"],
            ["preco_unit", "numeric(12,2)", "nn"]
          ],
          "pk": ["pedido_id", "item_seq"],
          "fk": [
            { "n": "fk_item_pedido_0", "c": ["produto_id"], "r": "main.produto", "rc": ["id"] },
            { "n": "fk_item_pedido_1", "c": ["pedido_id"], "r": "main.pedido", "rc": ["id"], "od": "cascade" }
          ],
          "ck": [ { "e": "quantidade > 0" } ],
          "x": { "withoutRowid": "1" }
        },
        {
          "name": "entrega",
          "cols": [
            ["id", "text", "nn"],
            ["pedido_id", "integer", "nn"],
            ["item_seq", "integer", "nn"],
            ["previsao", "date"],
            ["cep_entrega", "char(8)", "nn"]
          ],
          "pk": ["id"],
          "fk": [ { "n": "fk_entrega_0", "c": ["pedido_id", "item_seq"], "r": "main.item_pedido", "rc": ["pedido_id", "item_seq"] } ],
          "uq": [ { "c": ["pedido_id", "item_seq"] } ]
        }
      ],
      "views": [
        { "name": "vw_pedidos_cliente", "cols": [["cliente_id", "integer"], ["qtd_pedidos", "any"], ["valor_total", "any"]] }
      ],
      "triggers": [
        { "n": "trg_item_atualiza_total", "t": "item_pedido", "tm": "a", "ev": "i" }
      ]
    }
  ]
}
